{
  "$schema": "../schema/protocol-values.schema.json",
  "attempt_error": {
    "at": "2026-01-02T03:04:05.6789Z",
    "attempt": 3,
    "error": "worker failed: escaped \"detail\"",
    "trace": "frame one\nframe two"
  },
  "job_states": [
    {
      "state": "available",
      "unique_bit": 1
    },
    {
      "state": "cancelled",
      "unique_bit": 2
    },
    {
      "state": "completed",
      "unique_bit": 4
    },
    {
      "state": "discarded",
      "unique_bit": 8
    },
    {
      "state": "pending",
      "unique_bit": 16
    },
    {
      "state": "retryable",
      "unique_bit": 32
    },
    {
      "state": "running",
      "unique_bit": 64
    },
    {
      "state": "scheduled",
      "unique_bit": 128
    }
  ],
  "metadata_keys": {
    "output": "output",
    "periodic_job_id": "river:periodic_job_id",
    "rescue_count": "river:rescue_count",
    "resumable_cursor": "river:resumable_cursor",
    "resumable_step": "river:resumable_step",
    "unique_nonce": "river:unique_nonce"
  },
  "notifications": [
    {
      "fields": [
        {
          "name": "action",
          "omitempty": false
        },
        {
          "name": "job_id",
          "omitempty": true
        },
        {
          "name": "metadata",
          "omitempty": true
        },
        {
          "name": "queue",
          "omitempty": false
        }
      ],
      "name": "cancel",
      "payload": {
        "action": "cancel",
        "job_id": 42,
        "queue": "priority"
      },
      "source": "producer.go:controlEventPayload; riverdriver/riverpgxv5/internal/dbsqlc/river_job.sql:JobCancel",
      "topic": "river_control"
    },
    {
      "fields": [
        {
          "name": "queue",
          "omitempty": false
        }
      ],
      "name": "insert",
      "payload": {
        "queue": "priority"
      },
      "source": "producer.go:insertPayload",
      "topic": "river_insert"
    },
    {
      "fields": [
        {
          "name": "action",
          "omitempty": false
        },
        {
          "name": "job_id",
          "omitempty": true
        },
        {
          "name": "metadata",
          "omitempty": true
        },
        {
          "name": "queue",
          "omitempty": false
        }
      ],
      "name": "metadata_changed",
      "payload": {
        "action": "metadata_changed",
        "metadata": {
          "owner": "candidate"
        },
        "queue": "priority"
      },
      "source": "producer.go:controlEventPayload",
      "topic": "river_control"
    },
    {
      "fields": [
        {
          "name": "action",
          "omitempty": false
        },
        {
          "name": "job_id",
          "omitempty": true
        },
        {
          "name": "metadata",
          "omitempty": true
        },
        {
          "name": "queue",
          "omitempty": false
        }
      ],
      "name": "pause",
      "payload": {
        "action": "pause",
        "queue": "priority"
      },
      "source": "producer.go:controlEventPayload",
      "topic": "river_control"
    },
    {
      "fields": [
        {
          "name": "action",
          "omitempty": false
        },
        {
          "name": "leader_id",
          "omitempty": false
        }
      ],
      "name": "request_resign",
      "payload": {
        "action": "request_resign",
        "leader_id": ""
      },
      "source": "internal/leadership/elector.go:DBNotification",
      "topic": "river_leadership"
    },
    {
      "fields": [
        {
          "name": "action",
          "omitempty": false
        },
        {
          "name": "leader_id",
          "omitempty": false
        }
      ],
      "name": "resigned",
      "payload": {
        "action": "resigned",
        "leader_id": "client-1"
      },
      "source": "internal/leadership/elector.go:DBNotification; riverdriver/riverpgxv5/internal/dbsqlc/river_leader.sql:LeaderResign",
      "topic": "river_leadership"
    },
    {
      "fields": [
        {
          "name": "action",
          "omitempty": false
        },
        {
          "name": "job_id",
          "omitempty": true
        },
        {
          "name": "metadata",
          "omitempty": true
        },
        {
          "name": "queue",
          "omitempty": false
        }
      ],
      "name": "resume",
      "payload": {
        "action": "resume",
        "queue": "priority"
      },
      "source": "producer.go:controlEventPayload",
      "topic": "river_control"
    }
  ],
  "protocol_revision": 1,
  "reserved_metadata_keys": [
    {
      "applicability": "protocol_visible",
      "key": "cancel_attempted_at"
    },
    {
      "applicability": "protocol_visible",
      "key": "output"
    },
    {
      "applicability": "protocol_visible",
      "key": "periodic"
    },
    {
      "applicability": "protocol_visible",
      "key": "river:log"
    },
    {
      "applicability": "protocol_visible",
      "key": "river:periodic_job_id"
    },
    {
      "applicability": "protocol_visible",
      "key": "river:rescue_count"
    },
    {
      "applicability": "protocol_visible",
      "key": "river:resumable_cursor"
    },
    {
      "applicability": "protocol_visible",
      "key": "river:resumable_step"
    },
    {
      "applicability": "protocol_visible",
      "key": "river:unique_nonce"
    },
    {
      "applicability": "protocol_visible",
      "key": "snoozes"
    },
    {
      "applicability": "internal",
      "key": "unique_key_conflict"
    }
  ],
  "retry_cases": [
    {
      "error_count": 1,
      "job_id": 42,
      "max_delay_ns": 1100000000,
      "min_delay_ns": 900000000,
      "now": "2026-01-02T03:04:05.6789Z",
      "seed": 0
    },
    {
      "error_count": 2,
      "job_id": 42,
      "max_delay_ns": 17600000000,
      "min_delay_ns": 14400000000,
      "now": "2026-01-02T03:04:05.6789Z",
      "seed": 123
    },
    {
      "error_count": 3,
      "job_id": 9007199254740991,
      "max_delay_ns": 89100000000,
      "min_delay_ns": 72900000000,
      "now": "2026-01-02T03:04:05.6789Z",
      "seed": 18446744073709551615
    },
    {
      "error_count": 11,
      "job_id": 1,
      "max_delay_ns": 16105100000000,
      "min_delay_ns": 13176900000000,
      "now": "2026-01-02T03:04:05.6789Z",
      "seed": 456
    },
    {
      "error_count": 309,
      "job_id": 42,
      "max_delay_ns": 9223372036854775807,
      "min_delay_ns": 8204959224899999744,
      "now": "2026-01-02T03:04:05.6789Z",
      "seed": 789
    },
    {
      "error_count": 310,
      "job_id": 42,
      "max_delay_ns": 9223372036854775807,
      "min_delay_ns": 9223372036854775807,
      "now": "2026-01-02T03:04:05.6789Z",
      "seed": 123
    }
  ],
  "topics": {
    "control": "river_control",
    "insert": "river_insert",
    "leadership": "river_leadership"
  }
}
